{
  "version": "1.0",
  "source": {
    "image_path": "C:\\Users\\tangvx\\AppData\\Local\\Temp\\codex-clipboard-6b94462e-de9c-488d-a99f-70d2e4441038.png",
    "width_px": 1999,
    "height_px": 1125
  },
  "slide": {
    "width": 1280.0,
    "height": 720.0,
    "unit": "px"
  },
  "background": {
    "strategy": "cleaned",
    "image_path": "C:\\Users\\tangvx\\Documents\\AI ppt\\outputs\\two-pass-original-6b94462e\\detect\\cleaned-background.png",
    "fill": "#FAFBFD"
  },
  "elements": [
    {
      "id": "el_pass2_534f6643cc44",
      "kind": "image",
      "bbox": {
        "left": 423.25,
        "top": 264.96,
        "width": 24.33,
        "height": 8.96
      },
      "z": -300,
      "editable_score": 0.38,
      "render_strategy": "image",
      "image_path": "C:\\Users\\tangvx\\Documents\\AI ppt\\outputs\\two-pass-original-6b94462e\\detect\\assets\\el_pass2_534f6643cc44.png",
      "fit": "contain",
      "confidence": {
        "second_pass_visual": 0.017
      },
      "metadata": {
        "detector": "iterative_residual_components",
        "pass": 2,
        "class": "faint_structure",
        "source_bbox_px": {
          "left": 661,
          "top": 414,
          "width": 38,
          "height": 14
        },
        "source_area_px": 201
      }
    },
    {
      "id": "el_pass2_62c7a469566d",
      "kind": "image",
      "bbox": {
        "left": 78.12,
        "top": 357.76,
        "width": 11.53,
        "height": 23.04
      },
      "z": -299,
      "editable_score": 0.38,
      "render_strategy": "image",
      "image_path": "C:\\Users\\tangvx\\Documents\\AI ppt\\outputs\\two-pass-original-6b94462e\\detect\\assets\\el_pass2_62c7a469566d.png",
      "fit": "contain",
      "confidence": {
        "second_pass_visual": 0.017
      },
      "metadata": {
        "detector": "iterative_residual_components",
        "pass": 2,
        "class": "faint_structure",
        "source_bbox_px": {
          "left": 122,
          "top": 559,
          "width": 18,
          "height": 36
        },
        "source_area_px": 209
      }
    },
    {
      "id": "el_pass2_08023407cd3e",
      "kind": "image",
      "bbox": {
        "left": 595.5,
        "top": 530.56,
        "width": 42.26,
        "height": 5.76
      },
      "z": -298,
      "editable_score": 0.38,
      "render_strategy": "image",
      "image_path": "C:\\Users\\tangvx\\Documents\\AI ppt\\outputs\\two-pass-original-6b94462e\\detect\\assets\\el_pass2_08023407cd3e.png",
      "fit": "contain",
      "confidence": {
        "second_pass_visual": 0.018
      },
      "metadata": {
        "detector": "iterative_residual_components",
        "pass": 2,
        "class": "faint_structure",
        "source_bbox_px": {
          "left": 930,
          "top": 829,
          "width": 66,
          "height": 9
        },
        "source_area_px": 216
      }
    },
    {
      "id": "el_pass2_9bc8d530c018",
      "kind": "image",
      "bbox": {
        "left": 334.25,
        "top": 257.92,
        "width": 31.38,
        "height": 11.52
      },
      "z": -297,
      "editable_score": 0.38,
      "render_strategy": "image",
      "image_path": "C:\\Users\\tangvx\\Documents\\AI ppt\\outputs\\two-pass-original-6b94462e\\detect\\assets\\el_pass2_9bc8d530c018.png",
      "fit": "contain",
      "confidence": {
        "second_pass_visual": 0.018
      },
      "metadata": {
        "detector": "iterative_residual_components",
        "pass": 2,
        "class": "faint_structure",
        "source_bbox_px": {
          "left": 522,
          "top": 403,
          "width": 49,
          "height": 18
        },
        "source_area_px": 222
      }
    },
    {
      "id": "el_pass2_aa26473863ac",
      "kind": "image",
      "bbox": {
        "left": 510.98,
        "top": 305.92,
        "width": 20.49,
        "height": 7.04
      },
      "z": -296,
      "editable_score": 0.38,
      "render_strategy": "image",
      "image_path": "C:\\Users\\tangvx\\Documents\\AI ppt\\outputs\\two-pass-original-6b94462e\\detect\\assets\\el_pass2_aa26473863ac.png",
      "fit": "contain",
      "confidence": {
        "second_pass_visual": 0.019
      },
      "metadata": {
        "detector": "iterative_residual_components",
        "pass": 2,
        "class": "faint_structure",
        "source_bbox_px": {
          "left": 798,
          "top": 478,
          "width": 32,
          "height": 11
        },
        "source_area_px": 224
      }
    },
    {
      "id": "el_pass2_3d7d38fb1d46",
      "kind": "image",
      "bbox": {
        "left": 938.07,
        "top": 247.68,
        "width": 13.45,
        "height": 21.12
      },
      "z": -295,
      "editable_score": 0.38,
      "render_strategy": "image",
      "image_path": "C:\\Users\\tangvx\\Documents\\AI ppt\\outputs\\two-pass-original-6b94462e\\detect\\assets\\el_pass2_3d7d38fb1d46.png",
      "fit": "contain",
      "confidence": {
        "second_pass_visual": 0.022
      },
      "metadata": {
        "detector": "iterative_residual_components",
        "pass": 2,
        "class": "faint_structure",
        "source_bbox_px": {
          "left": 1465,
          "top": 387,
          "width": 21,
          "height": 33
        },
        "source_area_px": 268
      }
    },
    {
      "id": "el_pass2_2303a0eb62fd",
      "kind": "image",
      "bbox": {
        "left": 423.89,
        "top": 244.48,
        "width": 22.41,
        "height": 9.6
      },
      "z": -294,
      "editable_score": 0.38,
      "render_strategy": "image",
      "image_path": "C:\\Users\\tangvx\\Documents\\AI ppt\\outputs\\two-pass-original-6b94462e\\detect\\assets\\el_pass2_2303a0eb62fd.png",
      "fit": "contain",
      "confidence": {
        "second_pass_visual": 0.023
      },
      "metadata": {
        "detector": "iterative_residual_components",
        "pass": 2,
        "class": "faint_structure",
        "source_bbox_px": {
          "left": 662,
          "top": 382,
          "width": 35,
          "height": 15
        },
        "source_area_px": 277
      }
    },
    {
      "id": "el_pass2_77411135557f",
      "kind": "image",
      "bbox": {
        "left": 68.51,
        "top": 446.08,
        "width": 21.77,
        "height": 28.8
      },
      "z": -293,
      "editable_score": 0.38,
      "render_strategy": "image",
      "image_path": "C:\\Users\\tangvx\\Documents\\AI ppt\\outputs\\two-pass-original-6b94462e\\detect\\assets\\el_pass2_77411135557f.png",
      "fit": "contain",
      "confidence": {
        "second_pass_visual": 0.024
      },
      "metadata": {
        "detector": "iterative_residual_components",
        "pass": 2,
        "class": "faint_structure",
        "source_bbox_px": {
          "left": 107,
          "top": 697,
          "width": 34,
          "height": 45
        },
        "source_area_px": 289
      }
    },
    {
      "id": "el_pass2_85dbf152200b",
      "kind": "image",
      "bbox": {
        "left": 466.79,
        "top": 482.56,
        "width": 29.45,
        "height": 13.44
      },
      "z": -292,
      "editable_score": 0.38,
      "render_strategy": "image",
      "image_path": "C:\\Users\\tangvx\\Documents\\AI ppt\\outputs\\two-pass-original-6b94462e\\detect\\assets\\el_pass2_85dbf152200b.png",
      "fit": "contain",
      "confidence": {
        "second_pass_visual": 0.03
      },
      "metadata": {
        "detector": "iterative_residual_components",
        "pass": 2,
        "class": "faint_structure",
        "source_bbox_px": {
          "left": 729,
          "top": 754,
          "width": 46,
          "height": 21
        },
        "source_area_px": 358
      }
    },
    {
      "id": "el_pass2_77b187eaf324",
      "kind": "image",
      "bbox": {
        "left": 1009.78,
        "top": 95.36,
        "width": 73.64,
        "height": 2.56
      },
      "z": -291,
      "editable_score": 0.38,
      "render_strategy": "image",
      "image_path": "C:\\Users\\tangvx\\Documents\\AI ppt\\outputs\\two-pass-original-6b94462e\\detect\\assets\\el_pass2_77b187eaf324.png",
      "fit": "contain",
      "confidence": {
        "second_pass_visual": 0.031
      },
      "metadata": {
        "detector": "iterative_residual_components",
        "pass": 2,
        "class": "faint_structure",
        "source_bbox_px": {
          "left": 1577,
          "top": 149,
          "width": 115,
          "height": 4
        },
        "source_area_px": 368
      }
    },
    {
      "id": "el_pass2_41113ed17f0a",
      "kind": "image",
      "bbox": {
        "left": 706.27,
        "top": 474.24,
        "width": 28.81,
        "height": 21.12
      },
      "z": -290,
      "editable_score": 0.38,
      "render_strategy": "image",
      "image_path": "C:\\Users\\tangvx\\Documents\\AI ppt\\outputs\\two-pass-original-6b94462e\\detect\\assets\\el_pass2_41113ed17f0a.png",
      "fit": "contain",
      "confidence": {
        "second_pass_visual": 0.032
      },
      "metadata": {
        "detector": "iterative_residual_components",
        "pass": 2,
        "class": "faint_structure",
        "source_bbox_px": {
          "left": 1103,
          "top": 741,
          "width": 45,
          "height": 33
        },
        "source_area_px": 388
      }
    },
    {
      "id": "el_pass2_54213f70f8bc",
      "kind": "image",
      "bbox": {
        "left": 1153.86,
        "top": 65.92,
        "width": 32.02,
        "height": 13.44
      },
      "z": -289,
      "editable_score": 0.38,
      "render_strategy": "image",
      "image_path": "C:\\Users\\tangvx\\Documents\\AI ppt\\outputs\\two-pass-original-6b94462e\\detect\\assets\\el_pass2_54213f70f8bc.png",
      "fit": "contain",
      "confidence": {
        "second_pass_visual": 0.041
      },
      "metadata": {
        "detector": "iterative_residual_components",
        "pass": 2,
        "class": "faint_structure",
        "source_bbox_px": {
          "left": 1802,
          "top": 103,